techname,tag,category,companyname,img,tagline,description,srcurl
４Dニット・ラッシェル機,,スポーツ,日本マイヤー株式会社,http://info.pref.fukui.jp/tisan/sangakukan/jitsuwafukui/images/textile/nipponmayer04.jpg,スペーサーの立体的な柄表現,本製品は、ピエゾジャカードによるスペーサーファブリックの柄表現をさらに進化させ立体的な表現を可能にしたダブルジャカードラッシェル機で、スポーツシューズだけでなく、ホームテキスタイルやアパレルでの使用が大きく期待される製品で、環境問題が取り上げられる近年、マイクロプラスチックを発生しないアウターウェアの新しい生産方法として4Dニット生地が大手ブランドの注目を浴びています。,http://info.pref.fukui.jp/tisan/sangakukan/jitsuwafukui/fashion/041.html
総合スポーツクラブシステム,国内シェア1位,スポーツ,株式会社ネスティ,http://info.pref.fukui.jp/tisan/sangakukan/jitsuwafukui/images/ict/nesty02.jpg,顧客ニーズにきめ細かく応える高度なシステム設計。クラウド型システムに対応,「PeGasus F1シリーズ」は、スポーツクラブでのフロント業務や会費の支払い状況の管理のほか、ユーザ1人1人のトレーニングや体力状況の管理など、25のサブシステムから構成されています。顧客ごとの要望にきめ細かく応えるためのオブジェクト指向型システム設計や、操作しやすい画面設計など、当社がこれまでに蓄積したノウハウを基に、顧客ニーズを取り入れたカスタマイズ型標準システムです。開発からこれまでの30年間、時代に合わせて6回のバージョンアップを実行しています。,http://info.pref.fukui.jp/tisan/sangakukan/jitsuwafukui/sports/158.html
ダブルラッセルのセンターカット素材,,ファッション,八田経編株式会社,http://info.pref.fukui.jp/tisan/sangakukan/jitsuwafukui/images/textile/hattatateami02.jpg,厚さわずか2ミリのダブルラッセル生地を精度よく2枚にカット,高品質の生地を生み出す経編機「ダブルラッセル機」で編んだ生地を2枚にカットし、ベロア調の低パイル（短い毛足）の生地を開発、製造。本来相容れにくかった「やわらかさ」と「シルエットの奇麗さ」を両立した製品で、軽くしなやかで適度な伸びがあり、しわにならないという高い付加価値を持っており、国内外のアパレルメーカーから高い評価を得ています。現在は、毛足の長いフリース保温素材や自動車の内装材、ブラシなどにも毛の抜けにい環境配慮型有毛素材としても注目され採用が広がっております。,http://info.pref.fukui.jp/tisan/sangakukan/jitsuwafukui/fashion/042.html
ロー付け工程のないチタンメガネフレーム,国内シェア1位,ファッション,浜本テクニカル株式会社,http://info.pref.fukui.jp/tisan/sangakukan/jitsuwafukui/images/eyewear/hamamototech02.jpg,ミクロン精度の金型開発、高圧力プレス、３次元精密加工技術を駆使し実現,"この商品には、当社が長年培ったミクロンの精度を追求した金型開発、プレス技術、さらにはメガネとして必要な機能および形状を生み出す加工技術が活かされています。特に、レンズを保持するフロント部分は、最大６mmのチタン板材から一体鍛造成形するもので、そのためにメガネ業界では唯一となる6,300kNのパワープレスを導入し、実現可能とすることができました。",http://info.pref.fukui.jp/tisan/sangakukan/jitsuwafukui/fashion/132.html
多軸ロボットを活用した自動組付装置,,自動車,春江電子株式会社,http://info.pref.fukui.jp/tisan/sangakukan/jitsuwafukui/images/machine/haruedenshi02.jpg,多軸（6軸）ロボットによる自動化装置の一貫性生産体制,従来、「手組み」による組み付けしか出来なかったサブ・アッセンブリ・ユニットを多軸（6軸）ロボット/サーボによるティーチング（教示）技術を活用して、難易度の高い組み付け工程の自動化に挑戦し日本で初めて成功しました。人の作業感覚に依存した高度な組み付け動作をロボットに忠実再現させた他に類のない自動化装置を設計・開発から製造までの一貫生産で実現しています。,http://info.pref.fukui.jp/tisan/sangakukan/jitsuwafukui/machine/115.html
ラッピングプレート（鋳物研磨定盤）その他特殊鋳鉄、複合素材,世界シェア1位,住宅・家電,日立造船株式会社 機械・インフラ事業本部システム機械ビジネスユニット 若狭事務所,http://info.pref.fukui.jp/tisan/sangakukan/jitsuwafukui/images/machine/hitachizousen02.jpg,半導体、フラットパネル生産を担うハイテク新素材,ラッピングプレートとは、半導体の基板となるシリコンウェハーの研磨機に使用される台（定盤）のことで、当社は鋳造から機械加工まで一貫生産を行い、世界シェアナンバーワン（70％）の実績を誇っています。このほか、テレビなどのディスプレイ分野では液晶などのフラットパネルへの転換が加速する中、液晶ガラスパネルなどを研磨するラッピングプレートも生産。また、精密化の進む工作機械などの部品向けに特殊鋳物、複合材を開発・提供しています。,http://info.pref.fukui.jp/tisan/sangakukan/jitsuwafukui/housing/116.html
SPG-Remote Medical for SYNOV-R,,医療,株式会社ビットブレイン,http://info.pref.fukui.jp/tisan/sangakukan/jitsuwafukui/images/ict/bitbrain02.jpg,ネットワーク分離技術を実装する高セキュリティクラウドを利用したリモートデスクトップ,【関西ものづくり新選2021　特別賞受賞】国も認める高セキュリティで安心なリモートデスクトップです。『企業向け』社内のネットワーク機器の設定変更など不要とし、IT初心者でも簡単に導入が可能です。大変多くの金融機関に選ばれているテレワークツールです。『医療向け』インターネットから隔離されたネットワークにある電子カルテ情報を、院外から閲覧・書込み操作が可能となります。導入は専用ルータを設置するだけの手軽さで、ネットワーク機器の設定変更など不要とし、大規模病院からクリニックまで大変多くの医療機関に導入されている遠隔電子カルテツールです。,http://info.pref.fukui.jp/tisan/sangakukan/jitsuwafukui/medical/162.html
警察・消防署の紋章,国内シェア1位,社会インフラ・ソリューション,株式会社廣部硬器,http://info.pref.fukui.jp/tisan/sangakukan/jitsuwafukui/images/ceramic/hirobekoki02.jpg,高温焼成されたセラミックス製。純金焼付加工に特殊技術,当社は、セラミックス製の建造物用紋章を特殊製作しています。ダイヤスタイトの商標で全国の警察本部、消防本部管轄の建造物に採用され、警察紋章は、国内シェアナンバーワンを誇ります。また、ダイヤスタイトには、校章、館名文字、シンボルマーク、寺紋・家紋、陶壁・レリーフなど幅広い製品があります。,http://info.pref.fukui.jp/tisan/sangakukan/jitsuwafukui/city/081.html
セラミックス蓄光材「セラチッコウ」,国内シェア1位,社会インフラ・ソリューション,株式会社廣部硬器,http://info.pref.fukui.jp/tisan/sangakukan/jitsuwafukui/images/ceramic/hirobekoki03.jpg,耐久性を生み出す焼成加工技術。超高輝度、長残光に高評価,当社が製造するセラチッコウ（セラミックス蓄光材）は、突然の暗闇に瞬時発光して、地震・火災などの非常災害時における避難路を確保し、人々を安全な場所に誘導する手助けとなります。当社は国内で先駆けてセラミックス蓄光材を手掛け、視覚障害者用点字鋲にはめ込んだ蓄光材では、国内シェアナンバーワンを誇ります。,http://info.pref.fukui.jp/tisan/sangakukan/jitsuwafukui/city/081.html
透かしマーク入り和紙,,住宅・家電,福井特殊紙株式会社,http://info.pref.fukui.jp/tisan/sangakukan/jitsuwafukui/images/other/fukui-tokusyushi02.jpg,紙の製造工程で透かしマークを入れる技術。偽造防止に効果,一見しただけでは何の特長もない紙ですが、裏面から光をあてることにより白く模様や文字が現れる…これが透かしマークと言われるもので、商品券、優待きっぷなどの金券類や卒業証書、免状、名刺、神社の御札の用紙などに使用されています。当社は、このような透かしマーク入りの和紙を生産しています。,http://info.pref.fukui.jp/tisan/sangakukan/jitsuwafukui/housing/176.html
ワイパー用　中空リベット,,自動車,福井鋲螺株式会社,http://info.pref.fukui.jp/tisan/sangakukan/jitsuwafukui/images/machine/fukuibyora02.jpg,「冷間鍛造技術」と「かしめ技術」により、トータル締結システムを提供,"自動車制御の電子化が広がり、微小で精密な部品の需要が高まる中、特殊形状・高精度が求められる取引先のオーダーに、当社は「冷間鍛造加工」というコア技術で応えています。シートベルト、スピードメーター、シフトレバー、ドラムブレーキなどの自動車部品には当社の鍛造パーツが使用され、その数は約2,000種類。中でも、ワイパーの金具同士の締結に使用される中空リベットは、リベット製造における「冷間鍛造技術」とリベットセッター（締結用機械）を使用した「かしめ技術」により、トータル締結システムで提供しています。当社の技術により、材質が特殊なリベットを高品質・低コストで提供するだけでなく、ワイパーの滑らかな動作に重要な支点の役目を果たすリベットの、締結不具合のない安全性も確立し、ユーザーに好評を得ています。",http://info.pref.fukui.jp/tisan/sangakukan/jitsuwafukui/car/118.html
蛍光灯ピン,世界シェア1位,住宅・家電,福井鋲螺株式会社,http://info.pref.fukui.jp/tisan/sangakukan/jitsuwafukui/images/machine/fukuibyora03.jpg,世界シェアNo.1身近な蛍光灯にも当社の先端技術が活かされています,日常目にしている蛍光灯の両端に2本ずつ、計4本のピンがあります。当社が製造するピンは、2003年以降、世界の大手電機メーカーにも採用され、世界シェアナンバーワンを誇っています。また、直径2mm以下の鍛造パーツの分野では、国内において多くのシェアを占め、プラズマディスプレイやパソコンの電子部品、携帯電話の微小部品など多くの製品に使用されています。当社の技術は、切り屑を出さない加工方法と、鉛を含まない材料の使用で環境に配慮している点でも評価を受けています。,http://info.pref.fukui.jp/tisan/sangakukan/jitsuwafukui/car/118.html
積層セラミックコンデンサ,世界シェア1位,スマートフォン,株式会社福井村田製作所,http://info.pref.fukui.jp/tisan/sangakukan/jitsuwafukui/images/electro/fukui-murata02.jpg,シングルμmオーダーの薄層化技術を量産レベル で確立、実用化,"コンデンサとは一時的に電気を蓄える機能をもった電子部品。スマートフォンでは1台あたり約1000個、パソコンで約800個、自動車には約5,000〜8,000個程度搭載されています。小型化と高性能化が求められる現在、電極を形成したセラミックシートを何枚も積み重ねた「積層セラミックコンデンサ」が数多く使われており、この生産においてムラタグループ全体で世界シェア約40％（第1位）を占めており、このうち半分を当社で生産しています。現在、当社はムラタグループのフラッグシップ事業所として、世界最小の積層セラミックコンデンサ（0.25mm×0.125mm）の量産を進めており、更なるモバイル機器の小型化と高性能化に貢献できる部品を世界に先駆けて提案していきます。",http://info.pref.fukui.jp/tisan/sangakukan/jitsuwafukui/smartphone/148.html
ヌレンザ（超撥水性繊維を使用した濡れない傘）,,ファッション,株式会社福井洋傘,http://info.pref.fukui.jp/tisan/sangakukan/jitsuwafukui/images/other/fukui-yougasa02.jpg,新素材を駆使した傘づくりが特徴,北陸技術交流テクノフェアのクレーム博覧会に寄せられた「雨の日、電車などでは傘の滴が他人に迷惑」との声を解決するために、開発した製品です。こんな傘があったらといった要望や不具合を解決することで、商品開発に活かしてきたことが当社の原動力です。（平成19年に「元気なモノ作り中小企業300社」（経済産業省）に選定）,http://info.pref.fukui.jp/tisan/sangakukan/jitsuwafukui/fashion/177.html
スパーブ291（平板瓦）（一体葺き回し工法、茅葺風屋根瓦工法）,世界シェア1位,住宅・家電,福井窯業株式会社,http://info.pref.fukui.jp/tisan/sangakukan/jitsuwafukui/images/ceramic/fukuiyogyo02.jpg,曲線を境目なく平板の陶板瓦でつなぎ、優雅な湾曲を可能にした施工法,この施工には特注品の陶板瓦スパーブ291「神宮瓦」を採用。10種類ほどの形を用意し、境目なくつなぐ一体葺き廻しにより、優雅な湾曲に仕上げることができました。屋根瓦の歴史的意匠の自由度が増すネオ・トラディショナルな現代的日本建築が可能になった施工方法であると自負しています。また、工法（曲がり屋根に瓦を敷設する工法）は特許を取得しております。福井の宝である笏谷石は現在では採掘されていません。当社では笏谷石の歴史と文化を後世に残していくため、スパーブ291シリーズで笏谷石風陶板瓦を製作しました。笏谷石の風化した色合いも5色の混ぜ葺きで表現しました。,http://info.pref.fukui.jp/tisan/sangakukan/jitsuwafukui/housing/082.html
緩み止め機能付きナット（高品質精密切削加工技術）,,ファッション,株式会社フクオカラシ,http://info.pref.fukui.jp/tisan/sangakukan/jitsuwafukui/images/eyewear/fukuokarashi02.jpg,精密切削加工技術が生み出す緩み止め機能付きナット,通常のナットを使用した場合、振動や衝撃などにより時間がたつにつれネジが徐々に緩んでしまい、ガタつきの原因となっていました。その問題をクリアさせたのが、緩み止め機能を付加させた世界最小の緩み止め機能付きナット「クロスグリップナット」です。ネジを挿入すると、4つのファクター（ツメ部）が外側に押し広げられ、その反発力が中心部に集中。ネジが強力に締め付けられ、振動や衝撃によるネジの緩みを防止し、その効果は持続します。本製品は、メガネフレームのレンズ締結部のほか、自動車など、ネジの緩みに悩まされる様々な業界で採用されています。,http://info.pref.fukui.jp/tisan/sangakukan/jitsuwafukui/fashion/133.html
超高温環境や急速冷却状態を生み出す「多相交流アークプラズマ装置」,,スマートフォン,福伸工業株式会社,http://info.pref.fukui.jp/tisan/sangakukan/jitsuwafukui/images/machine/fukushin02.jpg,ACプラズマによる低コスト・高性能ナノマテリアルを大量合成,"多相交流アークプラズマ装置は、容器を水冷構造で製作しており、その中で超高温環境（3,000℃～10,000℃）を生み出し、通常の加熱方法ではできない熱処理が可能です。超高温による材料の蒸発や、急速な冷却過程を経ることで、様々なナノ粒子を製造することができ、特に当社の装置は超高温領域を広く設けることができるため、ナノ粒子の大量生成に向いていると評価されています。自動車、スマートフォン、医療分野など身近な製品で広く応用できます。",http://info.pref.fukui.jp/tisan/sangakukan/jitsuwafukui/smartphone/119.html
多段式パレット水平移送３Dコンベア,,機械・ロボット,福伸工業株式会社,http://info.pref.fukui.jp/tisan/sangakukan/jitsuwafukui/images/machine/fukushin03.jpg,食品を加熱・冷却しながら移送できる食品用コンベア,食品を加熱・冷却しながら移送できるコンベアシステム。冷凍食品やカップ食品などの加熱・冷却・乾燥・発酵・保管することができます。従来型のシステムは平面的ですが、これを多階層（9段～13段）にすることで、装置自体の小型化が可能になり、設置スペースや電力のコストダウンにつながっています。また、加熱装置と冷却装置を組み合わせることで、1台で2つの処理ができるなど、あらゆるニーズに合わせて設計・製作しています。,http://info.pref.fukui.jp/tisan/sangakukan/jitsuwafukui/smartphone/119.html
アルパレージ,国内シェア1位,住宅・家電,フクビ化学工業株式会社,http://info.pref.fukui.jp/tisan/sangakukan/jitsuwafukui/images/plastic/fukuvi02.jpg,異形押出成形技術とインクジェット印刷技術などの諸技術を組み合わせた製品,アルパレージは、浴室や洗面脱衣室などサニタリー全般の壁、天井に使用可能な抗菌仕様のパネルです。冬場でも暖かい空間を維持できる高い断熱性や、浴室でも使用可能な耐水性を有しています。さらには、表面UVコートで汚れが付きにくく、付いた汚れも簡単に拭き取れる仕様となっています。乾式（工場で製造した壁材などを現場で取り付ける工法）の断熱パネルでは国内シェアナンバーワンとなっています。,http://info.pref.fukui.jp/tisan/sangakukan/jitsuwafukui/housing/078.html
メディカル白衣（看護衣）,国内シェア1位,医療,冨士経編株式会社,http://info.pref.fukui.jp/tisan/sangakukan/jitsuwafukui/images/textile/fujitateami02.jpg,原糸から交編まで、独自加工技術が活きています,精密電子機器が多数あり、人の生命に関わる医療現場で着用される白衣（看護衣）の素材には、作業性や着心地がよいことはもちろん、静電気による誤作動やほこりを防ぐ機能が求められています。当社の製品は、吸汗性や通気性に優れる綿と電気を瞬時に逃す導電糸が混合され、経編トリコットにより柔らかい肌合いと伸縮性を実現。メディカル白衣（看護衣）の経編トリコットでの国内シェアナンバーワンを誇り、市場にて評価いただいています。,http://info.pref.fukui.jp/tisan/sangakukan/jitsuwafukui/medical/043.html
紙管を利用した締太鼓（商品名：新打楽器ヤマコ）,,カルチャー,プランニングヤマコウ,http://info.pref.fukui.jp/tisan/sangakukan/jitsuwafukui/images/other/planning-yamakou02.jpg,胴部分に紙管、皮部分にテントシートを使用し、独自の工夫で製品化,近年、保育園や小中学校の授業や老人介護施設のリハビリなどに和太鼓を取り入れるところが増えています。従来の締太鼓は、皮部分に牛や馬などの皮を使用し、胴部分には自然木を使用しているため、非常に高価であり、十分な数量を確保するのは困難です。当社は、子供たちに楽しく伸び伸びと太鼓を叩いてもらえるよう、安価で色や音質にも幅広く対応できる製品を開発しました（商品名：新打楽器ヤマコ）。環境にも配慮した材料を用い、メンテナンスも簡易な構造のため、地域での郷土芸能文化の活性化にも貢献できる製品となっています。,http://info.pref.fukui.jp/tisan/sangakukan/jitsuwafukui/culture/178.html
モニュメント型風力発電機,国内シェア1位,社会インフラ・ソリューション,株式会社プロード,http://info.pref.fukui.jp/tisan/sangakukan/jitsuwafukui/images/electro/proad02.jpg,ベアリングに磁気を利用した独自技術により毎秒2mの風力で発電可能に,プロードは、1994年に組合として鉄工、金属加工、電気 工事、設備、デザイナーなど異業種の中小企業経営者10人で設立。周辺環境に配慮した都市型風力発電機の共同研究に取組み、1998年に微風でも回転する静かなモニュメント型風力発電機「エオリカ」を開発しました。国内で唯一、モニュメント型風力発電機を製造しており、（独）国際協力機構（JICA）のプロジェクトでタンザニア に設置されるなど、これまでに国内外で約60基を納入しています。（平成16年度第3回産学官連携推進会議（内閣府主 催）の科学技術政策担当大臣賞を本県で初めて受賞）2020年には、協同組合プロードを株式会社プロードに組織変更いたしました。,http://info.pref.fukui.jp/tisan/sangakukan/jitsuwafukui/city/149.html
HC式防火水槽・耐震性貯水槽,国内シェア1位,社会インフラ・ソリューション,ベルテクス株式会社　福井本部,http://info.pref.fukui.jp/tisan/sangakukan/jitsuwafukui/images/ceramic/vertex02.jpg,防火水槽をコンクリート2次製品化し、工期短縮と省力化を実現。国内シェアNo.1,"当社が1981年に開発した「HC式防火水槽」は、日本初のコンクリート2次製品による組立式防火水槽で、（ー財）日本消防設備安全センターの2次製品防火水槽の認定第1号を取得。従来は、現場施工で各工程を人力で行っていたものを、コンクリート2次製品化することで大幅な工期短縮と省力化を実現しました。全国16社のコンクリート2次製品メーカーへの技術供与で全国供給の体制が整備され、全国で設置される2次製品防火水槽の50％以上のシェアを有し、これまでの実績は36,000基を超えています。",http://info.pref.fukui.jp/tisan/sangakukan/jitsuwafukui/city/85.html
無散水融雪システム,国内シェア1位,社会インフラ・ソリューション,ベルテクス株式会社　福井本部,http://info.pref.fukui.jp/tisan/sangakukan/jitsuwafukui/images/ceramic/vertex03.jpg,2倍以上の熱伝導率により高効率で省エネなシステム,「無散水融雪システム」は、管を埋め込んだコンクリート製パネルを車道や歩道に設置し、管に温かい水を通すことで凍結を防止したり、雪を融かすシステムです。水をまかないことで、水跳ねがなく快適な歩行が可能で、まいた水の凍結の心配もない、雪国の冬季バリアフリーを実現するシステムです。パネルはコンクリートに福井県産の特殊な骨材を使用しているため、普通のコンクリートに比べて2倍以上の熱伝導率があり、高い融雪能力を有している点が特長です。工場製作のため高強度・高品質で、従来の半分以下の工期での施工が可能です。融雪で使用した水は、散水として利用するなど、より環境に配慮したシステムも開発しています。,http://info.pref.fukui.jp/tisan/sangakukan/jitsuwafukui/city/85.html
コンクリート造エレベーターシャフト,,社会インフラ・ソリューション,ベルテクス株式会社　福井本部,http://info.pref.fukui.jp/tisan/sangakukan/jitsuwafukui/images/ceramic/vertex04.jpg,居住しながらの施工、および工期短縮と省力化を実現,「プレキャスト・プレストレストコンクリート造エレベーターシャフト」は、鉄筋コンクリート製ブロックの組立によるエレベーター専用建物で、（一財）ベターリビングで構造評定を受けた工法です。居住しながらの施工、および工期短縮と省力化を実現。既存建物の外側に既存建物と構造的に分離・独立するように設計・施工するため、暴風・地震による既存建物の被災危険度を増加させない技術であると共に、居住者・利用者が既存建物内に居る状態で工事を進められます。共同住宅・学校・公民館・図書館・ホテル等、多様な建物、並びに歩道橋などの既存建物にエレベーターを後付する場合に欠かせない技術であり、バリアフリー社会の構築に貢献できる技術です。,http://info.pref.fukui.jp/tisan/sangakukan/jitsuwafukui/city/85.html
