techname,tag,category,companyname,img,tagline,description,srcurl
天然たんぱく質「ピュアセリシンTM」を用いた製品,,ファッション,セーレン株式会社,http://info.pref.fukui.jp/tisan/sangakukan/jitsuwafukui/images/textile/seiren07.jpg,繭生まれの「ピュアセリシンTM」を様々な分野に応用,シルク特有のしっとりした風合いや艶やかな光沢を得るための工程は「精練」と呼ばれ、当社の歴史は「精練」から始まりました。この工程では、絹生糸の表面を覆う「セリシン」という天然たんぱく質を取り除いています。当社は、この「セリシン」に着目し、その特徴を解明。保水性・吸湿性に優れ、さらに美白機能・抗酸化機能・ガン抑制機能・細胞増殖機能・酵素安定化機能など様々な機能を有する成分であることを突き止めました。通常セリシンの大きさにはバラツキがあります。効果が高いとされる粒の大きさのみを精製する、世界初の独自製法で「ピュアセリシンTM」を開発し、化粧品のみならず医療医薬分野など様々な分野に応用しています。,http://info.pref.fukui.jp/tisan/sangakukan/jitsuwafukui/car/034.html
光通信用の部品基板（厚膜熱酸化膜付ウェーハ）,世界シェア1位,住宅・家電,セーレンＫＳＴ株式会社,http://info.pref.fukui.jp/tisan/sangakukan/jitsuwafukui/images/chemical/seiren-kst02.jpg,膜厚25μmまでの、均一で高品質な熱酸化膜を実現する加工技術,当社は、半導体や光通信に用いられるシリコンウェーハ上に、熱酸化膜などの各種膜付加工を行う国内初の成膜加工専門会社です。当社が製造する厚膜熱酸化膜ウェーハは、光通信の必須部品である光合分波器（光信号を１つに合波または複数に分波する装置）の基板や半導体デバイスの材料として採用されており、国内外の大手光通信デバイスメーカーへの独占的提供により、世界シェアナンバーワン（約70％）を誇っています。（平成18年に「元気なモノ作り中小企業300社（経済産業省）」に選定。平成19年に「第2回ものづくり日本大賞」の優秀賞を受賞。）,http://info.pref.fukui.jp/tisan/sangakukan/jitsuwafukui/housing/059.html
布目曲り自動矯正装置,国内シェア1位,ファッション,セーレン電子株式会社,http://info.pref.fukui.jp/tisan/sangakukan/jitsuwafukui/images/electro/seirendenshi02.jpg,世界で唯一、２つの検知機能を併せ持つデュアルモード検知方式の装置,各種織物、編物は染色仕上加工工程で、湾曲、斜行などの布目曲りが発生してしまいます。本装置は、緯糸の布目曲り方向および角度を検知し、コンピューター制御によって自動的にその布目曲りを矯正する、繊維加工業になくてはならない装置であり、国内シェアナンバーワン（90％）を誇っています。 当社は長年の研究による高度な技術と綿密な作業による高品質な製品の 供給を続けています。アジアを中心に海外の主要な展示会に出展し、グローバル展開を行っ ています。,http://info.pref.fukui.jp/tisan/sangakukan/jitsuwafukui/fashion/144.html
野球用木製バット,,スポーツ,ゼットクリエイト株式会社武生工場,http://info.pref.fukui.jp/tisan/sangakukan/jitsuwafukui/images/other/zett02.jpg,0.1ミリの精度が要求されるバット職人の技術,プロ野球のトップ選手が使用する木製バットは、そのほとんどが完全別注と言われるカスタム品で、3本のバイト（刃物）だけを使用して手作業で切削して製作しています。当社には、全国で数人しかいないとされるバット職人が2名在籍しており、年間約130名のプロ選手にバットを供給しています。精度の高いバットを約30分で製品の形状にまで仕上げる技術の習得には約5年が必要であり、若い世代への技術伝承にも取り組んでいます。,http://info.pref.fukui.jp/tisan/sangakukan/jitsuwafukui/sports/173.html
植物資源を不燃化する技術「セルフネン」,,住宅・家電,株式会社セルフネン,http://info.pref.fukui.jp/tisan/sangakukan/jitsuwafukui/images/chemical/cellfunen02.jpg,植物資源を不燃化する技術＜セルフネン＞,植物資源は再生可能な資源ですが、「燃える」「腐る」という性質により活用できる機会が限られています。その植物資源を100%活かすために「燃えにくい」「腐りにくい」という特質を付与することにより、活用の幅を広げ、付加価値を高めることができます。当社の技術「セルフネン」は植物資源に燃えにくく腐りにくいという特質を付与するだけでなく、炎が当たっても炭化するだけで着火せず、煙や有害ガスの発生も抑制しリサイクルも出来ます。セルフネン処理された植物資源素材は焼却時のCO2の発生が少ないため、セルフネン処理されてない素材より多くの炭素が固定化されます。,http://info.pref.fukui.jp/tisan/sangakukan/jitsuwafukui/housing/64.html
パソコンや家電製品などのプラスチック部の難燃剤,世界シェア1位,住宅・家電,大八化学工業株式会社　福井工場,http://info.pref.fukui.jp/tisan/sangakukan/jitsuwafukui/images/chemical/daihachi02.jpg,プラスチックに混ぜ易いように粉体状の製品とした技術が特徴,一般的な液体系難燃剤と比較し、「PX-200」は高純度とすることで固体（粉体）化を実現しました。この粉体化工程は過冷却現象を起こし、とても苦労しましたが、長年培ってきたエステル技術で問題を解決しました。結果、樹脂に添加する際、液体添加装置を必要とせず、樹脂生産の品種切り替えが容易となり、好評を得ています。,http://info.pref.fukui.jp/tisan/sangakukan/jitsuwafukui/housing/064.html
「立体展開検査方式」を搭載したラベル検査装置,,機械・ロボット,高嶋技研株式会社,http://info.pref.fukui.jp/tisan/sangakukan/jitsuwafukui/images/machine/takashimagiken02.jpg,画像処理に独自の工夫を加え、高精度自動検査装置を製作,ラベルが貼られたボトル製品（びん、缶、PET）等の外観を複数のカメラで撮像し、容器の形状・遠近歪等の補正によりひずみのない画像で自動検査する「立体展開検査方式」によって、従来の検査では困難だった比較的小さな破れ、汚れ、印刷不良などの欠陥を検出することが可能です。容器の向きに影響を受けず、高速ラインに対応できるため国内大手の飲料工場で数多く活躍しています。この技術は、飲料向けラベル検査だけでなく、立体物の外観検査等へも応用できます。,http://info.pref.fukui.jp/tisan/sangakukan/jitsuwafukui/machine/106.html
両頭フライス盤,国内シェア1位,機械・ロボット,株式会社武田機械,http://info.pref.fukui.jp/tisan/sangakukan/jitsuwafukui/images/machine/takedakikai02.jpg,熟練工のノウハウをデジタル化（数値制御化）し、高精度加工を実現,金型の元となるプレートには、ミクロン単位の高い精度と技術（寸法はもとより高い平行度・平面度・直角度）が求められます。受注するサイズも様々なので、プレート加工業者も多品種少量の受注に柔軟に対応する必要があります。両頭フライス盤は、材料を両側から同時に面削する機械であり、主に金型の元となるプレートの側面加工を誰でも高精度で行うことができます。本製品は、国内シェアナンバーワン（65％）を誇っています。,http://info.pref.fukui.jp/tisan/sangakukan/jitsuwafukui/machine/107.html
インナーウェア用レース（商品名：フォルポレース、レーシイ・リバーレース、ラックスレース）,国内シェア1位,ファッション,株式会社タケダレース,http://info.pref.fukui.jp/tisan/sangakukan/jitsuwafukui/images/textile/takedalace02.jpg,多種多様なレースデザインを創出。意匠活用優良企業として表彰も,当社は様々な用途のあるレースの中でも最も付加価値が高いインナーウェア用レースで国内シェアナンバーワン（40％）、世界でもトップクラスの生産量を誇っています。海外に生産子会社、生産合弁会社、販売子会社を持つなどグローバルな展開を図っており、当社のレースは日本はもとより欧米、アジア諸国にも販売されています。,http://info.pref.fukui.jp/tisan/sangakukan/jitsuwafukui/fashion/036.html
刃物、包丁用の異種金属複合材料（クラッド材料）,,住宅・家電,武生特殊鋼材株式会社,http://info.pref.fukui.jp/tisan/sangakukan/jitsuwafukui/images/machine/takehuyokusyu02.jpg,金属を知り尽くすことで確立した異種金属接合技術,当社が製造する性質の異なる2種以上の金属からなる複合材料（クラッド材料）は、各々の金属の長所を併せ持つ高機能材料として主に刃物用（家庭用から工業機械用まで）に使用され、業界ナンバーワンの高いシェアを占め、市場の信頼を得ています。中でもステンレス系オリジナル刃物鋼材（Ｖ鋼シリーズ）は、刃物業界で高い評価を受けています。刃物鋼をコアにし、両側を多積層にしたキッチンナイフは意匠性に優れ、強靭性を発揮。切れ味良く永切れ性を高めた包丁を、世の中に提供しています。,http://info.pref.fukui.jp/tisan/sangakukan/jitsuwafukui/housing/108.html
各種蚊帳（かや）,国内シェア1位,住宅・家電,タナカ株式会社,http://info.pref.fukui.jp/tisan/sangakukan/jitsuwafukui/images/other/tanaka02.jpg,夏を快適に過ごす蚊帳蚊やムカデ・エアコンの冷風から体を守ります,昔はどの家庭でも夏には必ず使用していた各種蚊帳。蚊やムカデ対策にはもちろんのこと、生活環境の変化により、①殺虫剤などの薬剤の不快感②エアコンの冷風が体に当たるのを防ぐ③節電への関心の高まり④蚊取り線香による煙や火災の心配など、蚊帳を求める人が、年々増えています。近年では、新しいインテリア・癒し空間として、再び室内用蚊帳が注目されていますがさらに、屋外で使用するアウトドア用蚊帳も人気があります。タナカでは、各種かやを原材料から一貫生産しており、国内シェアナンバーワン（90%）を誇っています。また当社製品は、百貨店、生協、スーパー、ホームセンター、ドラックストアほか、インターネットなどでお求めいただけます。,http://info.pref.fukui.jp/tisan/sangakukan/jitsuwafukui/housing/174.html
二次電池（充電式電池）用の正極材料,,自動車,株式会社田中化学研究所,http://info.pref.fukui.jp/tisan/sangakukan/jitsuwafukui/images/chemical/tanakachemical02.jpg,環境対応車などに使用される二次電池正極材料を開発・製造,当社の正極材料はEV（電気自動車）やHV（ハイブリッド車）、パワーツール（電動工具）などに幅広く搭載されているリチウムイオン電池やニッケル水素電池などの二次電池に使用されています。二次電池の主役がニッカド電池、ニッケル水素電池、リチウムイオン電池と移り変わるなか、当社は50年近くにわたり二次電池用の正極材料を製造販売し続けています。近年では、高出力が求められるHV用のニッケル水素電池や、高容量が求められるEV用のリチウムイオン電池向け高性能正極材料の開発・供給に注力しています。,http://info.pref.fukui.jp/tisan/sangakukan/jitsuwafukui/car/065.html
遺跡の形状保存剤,,カルチャー,株式会社田中地質コンサルタント,http://info.pref.fukui.jp/tisan/sangakukan/jitsuwafukui/images/other/tanaka-chishitsu02.jpg,粒子間の結合を強める成分｢ケイ素｣を材料にした製品開発,世界の遺跡などの文化遺産は近年の酸性雨などの環境変化の影響で急激に劣化・風化しており、その保全・修復が急がれています。遺跡の形状保存剤（商品名：TOT）は文化遺産の保存を目的に考古学者や化学者と共同で開発され、環境負荷の低い、安心・安全で使いやすい製品です。本製品は、エルサルバドルのマヤ遺跡の強化保存のほか、台湾地震断層の保存展示露頭面の強化保存処理に使用されています。,http://info.pref.fukui.jp/tisan/sangakukan/jitsuwafukui/culture/175.html
エンジン発電機,国内シェア1位,社会インフラ・ソリューション,デンヨー株式会社　福井工場,http://info.pref.fukui.jp/tisan/sangakukan/jitsuwafukui/images/machine/denyo02.jpg,波形歪が少なく、逆相耐量の大きい発電機,デンヨーのエンジン発電機は、台風・地震・火災などの災害時・病院の医療機器・ビルの排煙装置・オフィスや工場のコンピュータ・銀行のオンラインシステムなどの非常用電源としてさまざまな施設に導入されています。他の原動機と比較して熱効率が高く、燃料消費率が少なく経済的です。また、燃料は軽油やガソリンなどで容易に入手でき、国内シェアNo.1を誇っています。,http://info.pref.fukui.jp/tisan/sangakukan/jitsuwafukui/city/109.html
アルミ折戸「イスターカーテン」,国内シェア1位,社会インフラ・ソリューション,株式会社TOKO,http://info.pref.fukui.jp/tisan/sangakukan/jitsuwafukui/images/machine/toko02.jpg,アルミ製折れ戸に採用している「丁番（ちょうつがい）」はオンリーワン技術,アルミ製折れ戸「イスターカーテン」は、閉店後も店舗の中が見える透明シャッターの定番として広く知られ、空港ターミナルビルをはじめ全国の商業施設で多く採用され、2014年にはグッドデザイン　ロングライフデザイン賞を受賞しました。また、オンリーワン技術で進化を続ける「イスターカーテン」は圧倒的開放感を実現できる建具としても注目を集め、保育園や小学校など教育施設での採用機会が増えています。,http://info.pref.fukui.jp/tisan/sangakukan/jitsuwafukui/city/110.html
超薄地ニットの染色仕上加工,国内シェア1位,ファッション,東洋染工株式会社,http://info.pref.fukui.jp/tisan/sangakukan/jitsuwafukui/images/textile/toyosenko02.jpg,繊細で形状保持が難しい超薄地ニット生地の高品質な染色仕上加工,20ｇ/㎡以下のニット生地は手で触っただけでキズになる繊細なものです。軽量かつソフトで機能性も高く、トップメーカーのアウトドアウェア裏地など、多くの商品で採用されています。こうしたニット製品は高度な加工技術を要し、大部分の染色整理加工を当社が手掛けており、超薄地ニット加工といえば当社というイメージを打ち出すことができたと考えています。,http://info.pref.fukui.jp/tisan/sangakukan/jitsuwafukui/fashion/037.html
合成繊維に保湿機能を持たせる加工技術「ＳＫＩＮＤＹ」,,ファッション,東洋染工株式会社,http://info.pref.fukui.jp/tisan/sangakukan/jitsuwafukui/images/textile/toyosenko03.jpg,コラーゲンと繊維を化学結合で一体化させる画期的な手法,ナイロンは合成繊維であり、吸湿性・吸水性が乏しいですが、繊維とコラーゲンを一体化させる加工を行うことでこの課題を克服した、夢の繊維が出来ました。洗濯耐久性が高く、保湿性も高く肌に優しい群れ感やべたつき感が解消されており、Tシャツ、スポーツ、インナー分野に使用頂いております。,http://info.pref.fukui.jp/tisan/sangakukan/jitsuwafukui/fashion/037.html
吸水・撥水機能付快適衣料素材「アクアホール aquahole」,,スポーツ,東洋染工株式会社,http://info.pref.fukui.jp/tisan/sangakukan/jitsuwafukui/images/textile/toyosenko04.jpg,薄層アクアホールテクノロジー,一般的な吸水速乾の素材は如何によく水分を吸い込み、早く乾くことをうたい文句にしております。しかし乾くまでは表面が濡れています。アクアホールは吸水面に水分がほぼ残らないので、肌面がべたべたせず、汗をかいてもサラサラです。アクアホールの技術としては、生地全体に吸水処理を施したのち、凹凸のある生地面の凸部先端にのみ撥水加工を施します。そうすることで肌に接する凸部は常に乾いており、汗をかいてもサラサラな快適性を維持します。,http://info.pref.fukui.jp/tisan/sangakukan/jitsuwafukui/fashion/037.html
未来超音波製・超音波洗浄機,,機械・ロボット,常盤商事株式会社,http://info.pref.fukui.jp/tisan/sangakukan/jitsuwafukui/images/machine/tokiwa02.jpg,お客様のご希望に応じた洗浄装置を安価で提案,超音波洗浄機は、様々な製品の製造工程で要求される「洗浄」の分野で活用されています。しかし超音波洗浄機は高価であり、消耗品でもあることから、ランニングコストがネックになっていました。この問題を解決するために、当社では韓国・未来超音波技術と技術提携を行うことにより、低価格化の実現に成功いたしました。すべて特注設計のため、様々な仕様の超音波洗浄機を製作することが可能、そして特注設計に係る追加費用がありません。また、他メーカーの洗浄装置の「超音波装置」のみの交換も可能です。これは当社のオンリーワン技術で、全国各地から工事の依頼をいただいております。,http://info.pref.fukui.jp/tisan/sangakukan/jitsuwafukui/car/111.html
シートヒーター （蓄熱式ホットクッション、医療用など）,,医療 ,有限会社トップテクノ,http://info.pref.fukui.jp/tisan/sangakukan/jitsuwafukui/images/electro/top-techno02.jpg,ハイテクから日常製品まで応用されているシートヒーター,当社は、薄い・軽い・柔らかいを特長とした産業用シートヒーター（面状発熱体）専門のメーカです。当社シートヒーターは、医療分野をはじめ、工業、農業用になど幅広く使用されています。フレキシブルシートヒーターでは、業界に先駆け防水ラバーヒーターを開発し、また市場のニーズを受け、モバイルバッテリーに接続できるUSBケーブル仕様のヒーターも製品化しました。さらに、一般向けとして、特殊な蓄熱パックと組み合わせた オリジナル商品「ホット座布団・クッション」を開発。持ち運びが可能なうえ、1時間の蓄熱により暖かさを４～５時間保つことができ、冷え性でお困りの方はもとより寒い季節のスポーツ観戦や釣り、暖房の行き届かないオフィスでのデスクワークなどに最適な省エネ製品として好評を得ています。,http://info.pref.fukui.jp/tisan/sangakukan/jitsuwafukui/medical/146.html
眼鏡フレームに性質の全く異なる二つの素材を採用する「二重射出成型」技術,,ファッション,株式会社ナカニシビジョン,http://info.pref.fukui.jp/tisan/sangakukan/jitsuwafukui/images/eyewear/nakanishivsion02.jpg,二重射出成型技術をメガネフレームに採用したオンリーワン企業,フレームの外側には、耐久性に優れたナイロン素材を採用し、顔に直接触れる内側には、密着性に優れたラバー素材を採用することで、かけ心地と強度を両立。さらに、鼻パット不要で、デザイン性を保った製品を実現。機能性とデザイン性を追求する海外ブランドとの取引を通じて、当社の技術は洗練され、成長を続けています。要求される品質をクリアするため、弾力性や耐久性を試験できるオリジナル機器をも開発。その姿勢を高く評価いただいています。▼株式会社ナカニシビジョン　公式 Facebookhttps://www.facebook.com/OfficialNakanishiVision/,http://info.pref.fukui.jp/tisan/sangakukan/jitsuwafukui/fashion/130.html
道路反射鏡（カーブミラー）,国内シェア1位,社会インフラ・ソリューション,ナック・ケイ・エス株式会社,http://info.pref.fukui.jp/tisan/sangakukan/jitsuwafukui/images/plastic/nackks02.jpg,シェアNo.1を支える真空成形技術、真空蒸着技術,現在の車社会において「道路反射鏡（カーブミラー）」は、交通の安全に欠かせない重要な役割を担っています。皆様ご存知のとおり、全国の交差点や十字路、車庫や駐車場の出入り口など、各地に多数設置されています。当社は「道路反射鏡」の製造において国内シェアナンバーワン（約40%）を誇ります。また、この道路反射鏡に使われる「アクリル樹脂製鏡面」も国内シェアナンバーワン（約70%）を誇り、日々の交通安全に欠かせないものとなっております。（平成18年「元気なモノ作り中小企業300社」経済産業省に選定）,http://info.pref.fukui.jp/tisan/sangakukan/jitsuwafukui/city/075.html
FRPプール,国内シェア3位,スポーツ,ナック・ケイ・エス株式会社,http://info.pref.fukui.jp/tisan/sangakukan/jitsuwafukui/images/plastic/nackks03.jpg,FRP成形技術と工法、様々なノウハウの融合,従来、遊泳用のプールは現場施工の鉄筋コンクリート製がほとんどでしたが、近年は安全面での配慮などから、FRP（繊維強化プラスチック）製やステンレス製が採用されています。当社は、FRP成形に関する様々な技術や工法を基に、FRP製の大型プールを製造しており、遊泳用や競技用プールの他、医療用やリハビリ用など、様々な用途やニーズに応じた製品を提供し、国内シェア第3位（10％）を誇ります。また、この技術を応用しアクリル樹脂との複合板を成形したり全国の水族館で大型ＦＲＰ製水槽をご使用頂いています。,http://info.pref.fukui.jp/tisan/sangakukan/jitsuwafukui/city/075.html
大出力レーザ加工システム,,機械・ロボット,株式会社ナ・デックスプロダクツナ・デックスレーザＲ＆Ｄセンター,http://info.pref.fukui.jp/tisan/sangakukan/jitsuwafukui/images/machine/nadex02.jpg,大出力ファイバーレーザの高品位な深溶込み特性を、ものづくり（生産プロセス）に,ファイバーレーザ発振器の高品位なビーム特性を活かした生産プロセスへの展開が進むにつれ、高出力化が必要とされ、ナ・デックスグループは大阪大学接合科学研究所の支援を得て、発振器メーカーのＩＰＧと世界最大出力の100kwファイバーレーザ発振器の導入を計画し、研究開発拠点として本センターを設立しました。本センターでは、その世界一高密度なエネルギー源を利用したレーザ加工技術の開発・研究と生産システムを構成する加工ヘッド等の機器開発に取り組み、ナ・デックスグループとして大出力レーザ加工の生産プロセス提案、システムインテグレーテーションを行っております。,http://info.pref.fukui.jp/tisan/sangakukan/jitsuwafukui/machine/112.html
チタンの微細精密部品加工,,航空・宇宙,株式会社西村金属,http://info.pref.fukui.jp/tisan/sangakukan/jitsuwafukui/images/eyewear/nishimurakinzoku02.jpg,コア技術は、NC旋盤加工による微細精密切削加工,当社は、チタン加工＆ステンレス加工の微細加工・精密部品加工専門町工場です。特にチタン加工は、世界有数の眼鏡産地「鯖江」で、チタン製眼鏡フレームの開発にチャレンジしたのをきっかけに様々なノウハウが蓄積されました。当社加工製品は、メガネフレームをはじめ、医療用のチタン部品、チタンアクセサリー部品、航空機部品、インプラント、アルカリイオン水生成機のチタン電極部、光センサー部品などに使用され、これら製品の小型化、軽量化、高付加価値化に伴い、チタンの微細精密加工の需要が急増しています。（平成21年に「元気なモノ作り中小企業300社」（経済産業省）に選定）,http://info.pref.fukui.jp/tisan/sangakukan/jitsuwafukui/aerospace/131.html
